{
  "_meta": {
    "schema": "https://raw.githubusercontent.com/amplience/dc-sample-blog-nextjs/master/schemas/blog.json",
    "deliveryId": "9cb44d61-d00b-49b7-b23b-72bb9a0a1de6",
    "deliveryKey": "blog",
    "name": "blog"
  },
  "title": "Blog",
  "heading": "heading",
  "searchPlaceHolder": "text"
}
